<?xml version="1.0" encoding="UTF-8" ?>

<!ELEMENT className ( #PCDATA ) >
<!ELEMENT amoeba:configuration ( proxy, connectionManagerList, dbServerList, queryRouter ) >
<!ATTLIST amoeba:configuration
  xmlns:amoeba CDATA #FIXED "http://amoeba.meidusa.com/" 
>

<!ELEMENT connectionManagerList ( connectionManager+ ) >

<!ELEMENT connectionManager (property* ) >
<!ATTLIST connectionManager name NMTOKEN #REQUIRED >
<!ATTLIST connectionManager class NMTOKEN #IMPLIED >

<!ELEMENT dbServer ( factoryConfig?, poolConfig* ) >
<!ATTLIST dbServer name NMTOKEN #REQUIRED >
<!ATTLIST dbServer virtual NMTOKEN #IMPLIED >
<!ATTLIST dbServer abstractive NMTOKEN #IMPLIED >
<!ATTLIST dbServer parent NMTOKEN #IMPLIED >

<!ELEMENT dbServerList ( dbServer+ ) >

<!ELEMENT factoryConfig (property* ) >
<!ATTLIST factoryConfig class NMTOKEN #IMPLIED >

<!ELEMENT poolConfig (property* ) >
<!ATTLIST poolConfig class NMTOKEN #IMPLIED >

<!ELEMENT property ( #PCDATA | bean)* >

<!ELEMENT bean (property*) >
<!ATTLIST bean name NMTOKEN #IMPLIED >
<!ATTLIST bean class NMTOKEN #REQUIRED >

<!ATTLIST property name CDATA #REQUIRED >

<!ATTLIST queryRouter class NMTOKEN #IMPLIED >

<!ELEMENT queryRouter (property*) >

<!ATTLIST proxy class NMTOKEN #IMPLIED >
<!ELEMENT proxy ( server,runtime ) >

<!ATTLIST server class NMTOKEN #IMPLIED >
<!ELEMENT server (property*) >

<!ATTLIST runtime class NMTOKEN #IMPLIED >
<!ELEMENT runtime (property*) >

